
Setting environment for using XAMPP for Windows.
L420@L420-PC c:\xampp
# mysql -u root -p dbpegawai
Enter password:
Welcome to the MariaDB monitor.  Commands end with ; or \g.
Your MariaDB connection id is 10
Server version: 10.4.21-MariaDB mariadb.org binary distribution

Copyright (c) 2000, 2018, Oracle, MariaDB Corporation Ab and others.

Type 'help;' or '\h' for help. Type '\c' to clear the current input statement.

-- 1. tambah kolom foto setelah berat badan
MariaDB [dbpegawai]> ALTER TABLE pegawai ADD COLUMN
    -> foto varchar(30) after berat_batan;
Query OK, 0 rows affected (0.310 sec)
Records: 0  Duplicates: 0  Warnings: 0

MariaDB [dbpegawai]> desc pegawai;
+---------------+---------------+------+-----+---------+-------+
| Field         | Type          | Null | Key | Default | Extra |
+---------------+---------------+------+-----+---------+-------+
| id            | int(11)       | NO   | PRI | NULL    |       |
| nip           | char(5)       | NO   |     | NULL    |       |
| nama          | varchar(30)   | NO   |     | NULL    |       |
| jenis_kelamin | enum('L','P') | NO   |     | NULL    |       |
| umur          | int(11)       | YES  |     | NULL    |       |
| berat_batan   | float         | YES  |     | NULL    |       |
| foto          | varchar(30)   | YES  |     | NULL    |       |
+---------------+---------------+------+-----+---------+-------+
7 rows in set (0.008 sec)

-- 2.menganti nama jenis kelamin ke gender
MariaDB [dbpegawai]> ALTER TABLE pegawai CHANGE jenis_kelamin gender enum('L','P
') not null;
Query OK, 0 rows affected (0.116 sec)
Records: 0  Duplicates: 0  Warnings: 0

MariaDB [dbpegawai]> desc pegawai;
+-------------+---------------+------+-----+---------+-------+
| Field       | Type          | Null | Key | Default | Extra |
+-------------+---------------+------+-----+---------+-------+
| id          | int(11)       | NO   | PRI | NULL    |       |
| nip         | char(5)       | NO   |     | NULL    |       |
| nama        | varchar(30)   | NO   |     | NULL    |       |
| gender      | enum('L','P') | NO   |     | NULL    |       |
| umur        | int(11)       | YES  |     | NULL    |       |
| berat_batan | float         | YES  |     | NULL    |       |
| foto        | varchar(30)   | YES  |     | NULL    |       |
+-------------+---------------+------+-----+---------+-------+
7 rows in set (0.005 sec)

-- 3. ubah tipe data umur ke float
MariaDB [dbpegawai]> ALTER TABLE pegawai MODIFY umur float;
Query OK, 0 rows affected (0.679 sec)
Records: 0  Duplicates: 0  Warnings: 0

MariaDB [dbpegawai]> desc pegawai;
+-------------+---------------+------+-----+---------+-------+
| Field       | Type          | Null | Key | Default | Extra |
+-------------+---------------+------+-----+---------+-------+
| id          | int(11)       | NO   | PRI | NULL    |       |
| nip         | char(5)       | NO   |     | NULL    |       |
| nama        | varchar(30)   | NO   |     | NULL    |       |
| gender      | enum('L','P') | NO   |     | NULL    |       |
| umur        | float         | YES  |     | NULL    |       |
| berat_batan | float         | YES  |     | NULL    |       |
| foto        | varchar(30)   | YES  |     | NULL    |       |
+-------------+---------------+------+-----+---------+-------+
7 rows in set (0.012 sec)


-- 4. ubah nama tabel ke staff
MariaDB [dbpegawai]> ALTER TABLE pegawai RENAME TO staff;
Query OK, 0 rows affected (0.184 sec)

MariaDB [dbpegawai]> desc staff;
+-------------+---------------+------+-----+---------+-------+
| Field       | Type          | Null | Key | Default | Extra |
+-------------+---------------+------+-----+---------+-------+
| id          | int(11)       | NO   | PRI | NULL    |       |
| nip         | char(5)       | NO   |     | NULL    |       |
| nama        | varchar(30)   | NO   |     | NULL    |       |
| gender      | enum('L','P') | NO   |     | NULL    |       |
| umur        | float         | YES  |     | NULL    |       |
| berat_batan | float         | YES  |     | NULL    |       |
| foto        | varchar(30)   | YES  |     | NULL    |       |
+-------------+---------------+------+-----+---------+-------+
7 rows in set (0.005 sec)

-- 5.input 
MariaDB [dbpegawai]> INSERT INTO staff VALUES
    -> ('',12314,'yanto','L',20,60,'');
Query OK, 1 row affected, 1 warning (0.097 sec)

MariaDB [dbpegawai]> select * from staff;
+----+-------+-------+---------------+------+-------------+------+
| id | nip   | nama  | jenis_kelamin | umur | berat_batan | foto |
+----+-------+-------+---------------+------+-------------+------+
|  0 | 12314 | yanto | L             |   20 |          60 |      |
+----+-------+-------+---------------+------+-------------+------+
1 row in set (0.040 sec)

MariaDB [dbpegawai]> INSERT INTO staff VALUES
    -> (3,32219,'yuyun','P',23,55,'');
Query OK, 1 row affected (0.209 sec)

MariaDB [dbpegawai]> INSERT INTO staff VALUES
    -> (2,94212,'budi','L',30,65,'');
Query OK, 1 row affected (0.088 sec)

MariaDB [dbpegawai]> INSERT INTO staff VALUES
    -> (4,38937,'naya','P',29,56,''),
    -> (5,52312,'wati','P',18,49,'');
Query OK, 2 rows affected (0.129 sec)
Records: 2  Duplicates: 0  Warnings: 0

MariaDB [dbpegawai]> select * from staff;
+----+-------+-------+---------------+------+-------------+------+
| id | nip   | nama  | jenis_kelamin | umur | berat_batan | foto |
+----+-------+-------+---------------+------+-------------+------+
|  0 | 12314 | yanto | L             |   20 |          60 |      |
|  2 | 94212 | budi  | L             |   30 |          65 |      |
|  3 | 32219 | yuyun | P             |   23 |          55 |      |
|  4 | 38937 | naya  | P             |   29 |          56 |      |
|  5 | 52312 | wati  | P             |   18 |          49 |      |
+----+-------+-------+---------------+------+-------------+------+
5 rows in set (0.001 sec)

-- 6. input menyebutkan kolom
MariaDB [dbpegawai]> INSERT INTO staff (id,nip,nama,jenis_kelamin,umur,berat_bat
an) VALUES
    -> (6,32133,'jamil','L',39,69),
    -> (7,42756,'hawa','P',23,58),
    -> (8,90432,'yon','L',89,50),
    -> (9,36451,'hatori','L',29,49),
    -> (10,84930,'mai','P',29,40);
Query OK, 5 rows affected (0.092 sec)
Records: 5  Duplicates: 0  Warnings: 0

MariaDB [dbpegawai]> select * from staff;
+----+-------+--------+---------------+------+-------------+------+
| id | nip   | nama   | jenis_kelamin | umur | berat_batan | foto |
+----+-------+--------+---------------+------+-------------+------+
|  0 | 12314 | yanto  | L             |   20 |          60 |      |
|  2 | 94212 | budi   | L             |   30 |          65 |      |
|  3 | 32219 | yuyun  | P             |   23 |          55 |      |
|  4 | 38937 | naya   | P             |   29 |          56 |      |
|  5 | 52312 | wati   | P             |   18 |          49 |      |
|  6 | 32133 | jamil  | L             |   39 |          69 | NULL |
|  7 | 42756 | hawa   | P             |   23 |          58 | NULL |
|  8 | 90432 | yon    | L             |   89 |          50 | NULL |
|  9 | 36451 | hatori | L             |   29 |          49 | NULL |
| 10 | 84930 | mai    | P             |   29 |          40 | NULL |
+----+-------+--------+---------------+------+-------------+------+
10 rows in set (0.001 sec)

-- 7. mengubah query
MariaDB [dbpegawai]> UPDATE staff SET foto = 'profil.jpg' WHERE id=0;
Query OK, 1 row affected (0.152 sec)
Rows matched: 1  Changed: 1  Warnings: 0

MariaDB [dbpegawai]> select * from staff;
+----+-------+--------+---------------+------+-------------+------------+
| id | nip   | nama   | jenis_kelamin | umur | berat_batan | foto       |
+----+-------+--------+---------------+------+-------------+------------+
|  0 | 12314 | yanto  | L             |   20 |          60 | profil.jpg |
|  2 | 94212 | budi   | L             |   30 |          65 |            |
|  3 | 32219 | yuyun  | P             |   23 |          55 |            |
|  4 | 38937 | naya   | P             |   29 |          56 |            |
|  5 | 52312 | wati   | P             |   18 |          49 |            |
|  6 | 32133 | jamil  | L             |   39 |          69 | NULL       |
|  7 | 42756 | hawa   | P             |   23 |          58 | NULL       |
|  8 | 90432 | yon    | L             |   89 |          50 | NULL       |
|  9 | 36451 | hatori | L             |   29 |          49 | NULL       |
| 10 | 84930 | mai    | P             |   29 |          40 | NULL       |
+----+-------+--------+---------------+------+-------------+------------+
10 rows in set (0.001 sec)

MariaDB [dbpegawai]> UPDATE staff SET umur=99 WHERE id=3;
Query OK, 1 row affected (0.081 sec)
Rows matched: 1  Changed: 1  Warnings: 0

MariaDB [dbpegawai]> select * from staff;
+----+-------+--------+---------------+------+-------------+------------+
| id | nip   | nama   | jenis_kelamin | umur | berat_batan | foto       |
+----+-------+--------+---------------+------+-------------+------------+
|  0 | 12314 | yanto  | L             |   20 |          60 | profil.jpg |
|  2 | 94212 | budi   | L             |   30 |          65 |            |
|  3 | 32219 | yuyun  | P             |   99 |          55 |            |
|  4 | 38937 | naya   | P             |   29 |          56 |            |
|  5 | 52312 | wati   | P             |   18 |          49 |            |
|  6 | 32133 | jamil  | L             |   39 |          69 | NULL       |
|  7 | 42756 | hawa   | P             |   23 |          58 | NULL       |
|  8 | 90432 | yon    | L             |   89 |          50 | NULL       |
|  9 | 36451 | hatori | L             |   29 |          49 | NULL       |
| 10 | 84930 | mai    | P             |   29 |          40 | NULL       |
+----+-------+--------+---------------+------+-------------+------------+
10 rows in set (0.001 sec)

-- 8. mengubah banyak kolom
MariaDB [dbpegawai]> UPDATE staff SET foto = 'profil.jpg', jenis_kelamin='P' WHE
RE id=9;
Query OK, 1 row affected (0.085 sec)
Rows matched: 1  Changed: 1  Warnings: 0

MariaDB [dbpegawai]> select * from staff;
+----+-------+--------+---------------+------+-------------+------------+
| id | nip   | nama   | jenis_kelamin | umur | berat_batan | foto       |
+----+-------+--------+---------------+------+-------------+------------+
|  0 | 12314 | yanto  | L             |   20 |          60 | profil.jpg |
|  2 | 94212 | budi   | L             |   30 |          65 |            |
|  3 | 32219 | yuyun  | P             |   99 |          55 |            |
|  4 | 38937 | naya   | P             |   29 |          56 |            |
|  5 | 52312 | wati   | P             |   18 |          49 |            |
|  6 | 32133 | jamil  | L             |   39 |          69 | NULL       |
|  7 | 42756 | hawa   | P             |   23 |          58 | NULL       |
|  8 | 90432 | yon    | L             |   89 |          50 | NULL       |
|  9 | 36451 | hatori | P             |   29 |          49 | profil.jpg |
| 10 | 84930 | mai    | P             |   29 |          40 | NULL       |
+----+-------+--------+---------------+------+-------------+------------+
10 rows in set (0.001 sec)

MariaDB [dbpegawai]> UPDATE staff SET foto = 'profil.jpg', jenis_kelamin='P' WHE
RE id=2;
Query OK, 1 row affected (0.077 sec)
Rows matched: 1  Changed: 1  Warnings: 0

MariaDB [dbpegawai]> select * from staff;
+----+-------+--------+---------------+------+-------------+------------+
| id | nip   | nama   | jenis_kelamin | umur | berat_batan | foto       |
+----+-------+--------+---------------+------+-------------+------------+
|  0 | 12314 | yanto  | L             |   20 |          60 | profil.jpg |
|  2 | 94212 | budi   | P             |   30 |          65 | profil.jpg |
|  3 | 32219 | yuyun  | P             |   99 |          55 |            |
|  4 | 38937 | naya   | P             |   29 |          56 |            |
|  5 | 52312 | wati   | P             |   18 |          49 |            |
|  6 | 32133 | jamil  | L             |   39 |          69 | NULL       |
|  7 | 42756 | hawa   | P             |   23 |          58 | NULL       |
|  8 | 90432 | yon    | L             |   89 |          50 | NULL       |
|  9 | 36451 | hatori | P             |   29 |          49 | profil.jpg |
| 10 | 84930 | mai    | P             |   29 |          40 | NULL       |
+----+-------+--------+---------------+------+-------------+------------+
10 rows in set (0.001 sec)

-- 9. hapus data laki2
MariaDB [dbpegawai]> DELETE FROM staff WHERE jenis_kelamin='L';
Query OK, 3 rows affected (0.174 sec)

MariaDB [dbpegawai]> select * from staff;
+----+-------+--------+---------------+------+-------------+------------+
| id | nip   | nama   | jenis_kelamin | umur | berat_batan | foto       |
+----+-------+--------+---------------+------+-------------+------------+
|  2 | 94212 | budi   | P             |   30 |          65 | profil.jpg |
|  3 | 32219 | yuyun  | P             |   99 |          55 |            |
|  4 | 38937 | naya   | P             |   29 |          56 |            |
|  5 | 52312 | wati   | P             |   18 |          49 |            |
|  7 | 42756 | hawa   | P             |   23 |          58 | NULL       |
|  9 | 36451 | hatori | P             |   29 |          49 | profil.jpg |
| 10 | 84930 | mai    | P             |   29 |          40 | NULL       |
+----+-------+--------+---------------+------+-------------+------------+
7 rows in set (0.001 sec)

-- 10. hapus data perempuan
MariaDB [dbpegawai]> DELETE FROM staff WHERE jenis_kelamin='P';
Query OK, 7 rows affected (0.097 sec)

MariaDB [dbpegawai]> select * from staff;
Empty set (0.001 sec)

MariaDB [dbpegawai]>